{
  "id": "makefontsgreatagain",
  "name": "MakeFontsGreatAgain",
  "repo": "Numbersf/MakeFontsGreatAgain",
  "category": "customization-ui",
  "softwareType": "flashable-module",
  "description": "System-wide Font Overrider with Unique GMS Masking & Multi-Range Unicode Filter.",
  "compatibility": [
    "Magisk",
    "KernelSU"
  ],
  "license": "Proprietary",
  "icon": "assets/icons/makefontsgreatagain.png",
  "stars": 339,
  "latestRelease": {
    "tag": "1717180003",
    "publishedAt": "2026-08-31T05:05:07Z",
    "url": "https://github.com/Numbersf/MakeFontsGreatAgain/releases/tag/1717180003",
    "downloadUrl": "https://github.com/Numbersf/MakeFontsGreatAgain/releases/download/1717180003/MFGA-17.0.1.08-31-alpha2.1717180003.zip",
    "assetName": "MFGA-17.0.1.08-31-alpha2.1717180003.zip"
  },
  "seo": {
    "title": "MakeFontsGreatAgain – Download (Magisk/KSU) | Magisk Hub",
    "description": "Download MakeFontsGreatAgain for Magisk and KernelSU. System-wide Font Overrider with Unique GMS Masking & Multi-Range Unicode Filter."
  },
  "contentTier": 1
}