{
  "id": "azenith",
  "name": "AZenith",
  "repo": "Liliya2727/AZenith",
  "category": "performance-kernel",
  "softwareType": "flashable-module",
  "description": "A Dynamic Performance Module to tweak gaming experience while keeping user preferences",
  "compatibility": [
    "Magisk",
    "KernelSU"
  ],
  "license": "Apache-2.0",
  "icon": "assets/icons/azenith.png",
  "stars": 139,
  "latestRelease": {
    "tag": "AZenith-5.3",
    "publishedAt": "2026-10-23T14:45:59Z",
    "url": "https://github.com/Liliya2727/AZenith/releases/tag/AZenith-5.3",
    "downloadUrl": "https://github.com/Liliya2727/AZenith/releases/download/AZenith-5.3/AZenith-5.3-2049-56aa3446-Stellars-Beta.zip",
    "assetName": "AZenith-5.3-2049-56aa3446-Stellars-Beta.zip"
  },
  "seo": {
    "title": "AZenith – Download (Magisk/KSU) | Magisk Hub",
    "description": "Download AZenith for Magisk and KernelSU. A Dynamic Performance Module to tweak gaming experience while keeping user preferences."
  },
  "contentTier": 1
}