{
  "id": "nano-ndk",
  "name": "nano-ndk",
  "repo": "Magisk-Modules-Repo/nano-ndk",
  "category": "development-instrumentation",
  "softwareType": "flashable-module",
  "description": "nano-ndk",
  "compatibility": [
    "Magisk"
  ],
  "license": "Proprietary",
  "icon": null,
  "stars": 201,
  "latestRelease": {
    "tag": "9300",
    "publishedAt": "2026-10-26T01:11:01Z",
    "url": "https://github.com/Magisk-Modules-Repo/nano-ndk/releases/tag/9300",
    "downloadUrl": "https://github.com/Magisk-Modules-Repo/nano-ndk/releases/download/9300/UPDATE-nano.Terminal.Editor.v9.3-signed.zip",
    "assetName": "UPDATE-nano.Terminal.Editor.v9.3-signed.zip"
  },
  "seo": {
    "title": "nano-ndk – Download (Magisk) | Magisk Hub",
    "description": "Download nano-ndk for Magisk. nano-ndk."
  },
  "contentTier": 1
}