{
  "id": "rezygisk",
  "name": "ReZygisk",
  "repo": "PerformanC/ReZygisk",
  "category": "root-management",
  "softwareType": "flashable-module",
  "description": "Transparent implementation of Zygisk.",
  "compatibility": [
    "Magisk",
    "KernelSU",
    "APatch"
  ],
  "license": "GPL-3.0",
  "icon": null,
  "stars": 4093,
  "latestRelease": {
    "tag": "v1.0.0",
    "publishedAt": "2026-05-10T23:08:58Z",
    "url": "https://github.com/PerformanC/ReZygisk/releases/tag/v1.0.0",
    "downloadUrl": "https://github.com/PerformanC/ReZygisk/releases/download/v1.0.0/ReZygisk-v1.0.0-release.zip",
    "assetName": "ReZygisk-v1.0.0-release.zip"
  },
  "seo": {
    "title": "ReZygisk – Download (Magisk/KSU/APatch) | Magisk Hub",
    "description": "Download ReZygisk for Magisk, KernelSU, and APatch. Transparent implementation of Zygisk."
  },
  "contentTier": 1
}