{
  "id": "hyperunlocked",
  "name": "HyperUnlocked",
  "repo": "ukriu/HyperUnlocked",
  "category": "system-environment",
  "softwareType": "flashable-module",
  "description": "A Magisk/KernelSU/APatch module to unlock high-end features on all Xiaomi devices.",
  "compatibility": [
    "Magisk"
  ],
  "license": "GPL-3.0",
  "icon": null,
  "stars": 258,
  "latestRelease": {
    "tag": "v2.3.2",
    "publishedAt": "2026-10-14T18:59:22Z",
    "url": "https://github.com/ukriu/HyperUnlocked/releases/tag/v2.3.2",
    "downloadUrl": "https://github.com/ukriu/HyperUnlocked/releases/download/v2.3.2/HyperUnlocked.zip",
    "assetName": "HyperUnlocked.zip"
  },
  "seo": {
    "title": "HyperUnlocked – Download (Magisk) | Magisk Hub",
    "description": "Download HyperUnlocked for Magisk. A Magisk/KernelSU/APatch module to unlock high-end features on all Xiaomi devices."
  },
  "contentTier": 1
}