{
  "id": "deepsuppressor",
  "name": "DeepSuppressor",
  "repo": "Aurora-Nasa-1/DeepSuppressor",
  "category": "performance-kernel",
  "softwareType": "flashable-module",
  "description": "A Magisk Module",
  "compatibility": [
    "Magisk"
  ],
  "license": "Proprietary",
  "icon": null,
  "stars": 20,
  "latestRelease": {
    "tag": "v0.2.0",
    "publishedAt": "2025-06-01T06:54:15Z",
    "url": "https://github.com/Aurora-Nasa-1/DeepSuppressor/releases/tag/v0.2.0",
    "downloadUrl": "https://github.com/Aurora-Nasa-1/DeepSuppressor/releases/download/v0.2.0/DeepSuppressor_f414499.zip",
    "assetName": "DeepSuppressor_f414499.zip"
  },
  "seo": {
    "title": "DeepSuppressor – Download (Magisk) | Magisk Hub",
    "description": "Download DeepSuppressor for Magisk. A Magisk Module."
  },
  "contentTier": 1
}