{
  "id": "clearbox",
  "name": "ClearBox",
  "repo": "FLYCOM-E/ClearBox",
  "category": "system-utilities",
  "softwareType": "flashable-module",
  "description": "A Magisk module dedicated to automatic cleaning and optimization of Android   |   一个致力于 Android 自动清理优化的 Magisk 模块",
  "compatibility": [
    "Magisk",
    "KernelSU"
  ],
  "license": "GPL-3.0",
  "icon": null,
  "stars": 53,
  "latestRelease": {
    "tag": "101-V5.2.1",
    "publishedAt": "2026-10-13T13:39:07Z",
    "url": "https://github.com/FLYCOM-E/ClearBox/releases/tag/101-V5.2.1",
    "downloadUrl": "https://github.com/FLYCOM-E/ClearBox/releases/download/101-V5.2.1/ClearBox-V5.2.1-101.zip",
    "assetName": "ClearBox-V5.2.1-101.zip"
  },
  "seo": {
    "title": "ClearBox – Download (Magisk/KSU) | Magisk Hub",
    "description": "Download ClearBox for Magisk and KernelSU. A Magisk module dedicated to automatic cleaning and optimization of Android | 一个致力于 Android..."
  },
  "contentTier": 1
}