{
  "id": "magisk",
  "name": "Magisk",
  "repo": "topjohnwu/Magisk",
  "category": "root-management",
  "softwareType": "flashable-module",
  "description": "The Magic Mask for Android",
  "compatibility": [
    "Magisk"
  ],
  "license": "GPL-3.0",
  "icon": "assets/icons/magisk.png",
  "stars": 63595,
  "latestRelease": {
    "tag": "v31.1",
    "publishedAt": "2026-10-25T02:03:45Z",
    "url": "https://github.com/topjohnwu/Magisk/releases/tag/v31.1",
    "downloadUrl": "https://github.com/topjohnwu/Magisk/releases/download/v31.1/Magisk-v31.1.apk",
    "assetName": "Magisk-v31.1.apk"
  },
  "seo": {
    "title": "Magisk – Download (Magisk) | Magisk Hub",
    "description": "Download Magisk for Magisk. The Magic Mask for Android."
  },
  "contentTier": 1
}