{
  "id": "shamiko",
  "name": "Shamiko",
  "repo": "LSPosed/LSPosed.github.io",
  "category": "root-management",
  "softwareType": "flashable-module",
  "description": "Zygisk-based root hiding module by LSPosed developers to conceal root, zygisk, and sensitive props from banking apps and integrity checks.",
  "compatibility": [
    "Magisk",
    "KernelSU",
    "APatch"
  ],
  "license": "Proprietary",
  "icon": null,
  "stars": 6365,
  "latestRelease": {
    "tag": "shamiko-414",
    "publishedAt": "2025-06-18T11:37:10Z",
    "url": "https://github.com/LSPosed/LSPosed.github.io/releases/tag/shamiko-414",
    "downloadUrl": "https://github.com/LSPosed/LSPosed.github.io/releases/download/shamiko-414/Shamiko-v1.2.5-414-release.zip",
    "assetName": "Shamiko-v1.2.5-414-release.zip"
  },
  "seo": {
    "title": "Shamiko – Download (Magisk/KSU/APatch) | Magisk Hub",
    "description": "Download Shamiko for Magisk, KernelSU, and APatch. Zygisk-based root hiding module by LSPosed developers to conceal root, zygisk, and..."
  },
  "contentTier": 1
}