{
  "id": "vpnhide",
  "name": "vpnhide",
  "repo": "okhsunrog/vpnhide",
  "category": "networking-proxies",
  "softwareType": "flashable-module",
  "description": "Hide active VPN from selected Android apps (kernel module + LSPosed + Zygisk)",
  "compatibility": [
    "Magisk",
    "KernelSU"
  ],
  "license": "Proprietary",
  "icon": "assets/icons/vpnhide.png",
  "stars": 647,
  "latestRelease": {
    "tag": "v1.3.1",
    "publishedAt": "2026-10-12T15:25:23Z",
    "url": "https://github.com/okhsunrog/vpnhide/releases/tag/v1.3.1",
    "downloadUrl": "https://github.com/okhsunrog/vpnhide/releases/download/v1.3.1/vpnhide-zygisk.zip",
    "assetName": "vpnhide-zygisk.zip"
  },
  "seo": {
    "title": "vpnhide – Download (Magisk/KSU) | Magisk Hub",
    "description": "Download vpnhide for Magisk and KernelSU. Hide active VPN from selected Android apps (kernel module + LSPosed + Zygisk)."
  },
  "contentTier": 1
}